{
  "id": "sociologic",
  "name": "SocioLogic",
  "provider": "SocioLogic",
  "homepage": "https://sociologic.xyz",
  "description": "Verifiable random number generation API.",
  "resource": "https://api.sociologic.xyz/v1/rng",
  "method": "GET",
  "category": "infra-gateway",
  "tags": [
    "rng",
    "randomness",
    "verifiable"
  ],
  "x402Version": 2,
  "network": "eip155:8453",
  "asset": "USDC",
  "priceUsd": "0.001",
  "pricingModel": "fixed-per-call",
  "floeCompatible": true,
  "status": "verified"
}
