{
  "id": "invybot",
  "name": "invy.bot",
  "provider": "invy.bot",
  "homepage": "https://invy.bot",
  "description": "Wallet token holdings across Ethereum and Solana.",
  "resource": "https://api.invy.bot/v1/holdings",
  "method": "GET",
  "category": "crypto-data",
  "tags": [
    "wallet",
    "holdings",
    "multichain"
  ],
  "x402Version": 2,
  "network": "eip155:8453",
  "asset": "USDC",
  "priceUsd": "0.002",
  "pricingModel": "fixed-per-call",
  "floeCompatible": true,
  "status": "verified"
}
