{
  "id": "slamai",
  "name": "SLAMai",
  "provider": "SLAMai",
  "homepage": "https://slamai.xyz",
  "description": "Smart-money intelligence on Base and Ethereum.",
  "resource": "https://api.slamai.xyz/v1/signals",
  "method": "GET",
  "category": "crypto-data",
  "tags": [
    "smart-money",
    "signals",
    "base"
  ],
  "x402Version": 2,
  "network": "eip155:8453",
  "asset": "USDC",
  "priceUsd": "0.005",
  "pricingModel": "fixed-per-call",
  "floeCompatible": true,
  "status": "verified"
}
