{
  "id": "augur",
  "name": "Augur",
  "provider": "Augur",
  "homepage": "https://augur.net",
  "description": "Base contract admission control.",
  "resource": "https://api.augur.net/v1/verify",
  "method": "POST",
  "category": "risk-security",
  "tags": [
    "verification",
    "admission",
    "contracts"
  ],
  "x402Version": 2,
  "network": "eip155:8453",
  "asset": "USDC",
  "priceUsd": "0.10",
  "pricingModel": "fixed-per-call",
  "floeCompatible": true,
  "status": "verified"
}
