{
  "id": "ordiscan",
  "name": "Ordiscan",
  "provider": "Ordiscan",
  "homepage": "https://ordiscan.com",
  "description": "Bitcoin Ordinals API and inscriptions, no API key.",
  "resource": "https://api.ordiscan.com/v1/inscriptions",
  "method": "GET",
  "category": "crypto-data",
  "tags": [
    "bitcoin",
    "ordinals",
    "inscriptions"
  ],
  "x402Version": 2,
  "network": "eip155:8453",
  "asset": "USDC",
  "priceUsd": "0.001",
  "pricingModel": "fixed-per-call",
  "floeCompatible": true,
  "status": "verified"
}
