{
  "id": "x402engine",
  "name": "x402engine",
  "provider": "x402engine",
  "description": "Voice gateway — OpenAI TTS ($0.01), ElevenLabs TTS ($0.02), and Nova-3 transcription ($0.10) behind one x402 host. Also settles on Solana and MegaETH.",
  "resource": "https://x402-gateway-production.up.railway.app/api/tts/openai",
  "method": "POST",
  "category": "llm-inference",
  "tags": [
    "text-to-speech",
    "speech-to-text",
    "voice"
  ],
  "x402Version": 2,
  "network": "eip155:8453",
  "asset": "USDC",
  "priceUsd": "0.01",
  "pricingModel": "tiered",
  "floeCompatible": true,
  "status": "verified"
}
